image_path,text,image_text,crop,stress_labels,source
plantvillage/tomato_powdery_mildew_0188.jpg,"Farmer reported flower drop affecting cotton yield, suggesting heat stress.",Tomato plant showing symptoms of powdery mildew. Indicates disease risk.,tomato,"['disease_risk', 'heat_stress']",combined
plantvillage/corn_late_blight_0189.jpg,"The rice crop shows visible signs of heat stress with burnt edges. Additionally, leaf spots suggests disease risk.",Corn plant showing symptoms of late blight. Indicates disease risk.,corn,"['disease_risk', 'heat_stress']",combined
plantvillage/potato_healthy_0190.jpg,"Observed chewed leaf edges in potato plantation. Diagnosis: pest risk. Additionally, tissue death suggests heat stress.",Healthy potato plant with no visible signs of stress or disease.,potato,"['heat_stress', 'pest_risk']",combined
plantvillage/cucumber_mosaic_virus_0191.jpg,corn plants are experiencing nutrient def as evidenced by stunted growth.,Cucumber plant showing symptoms of mosaic virus. Indicates disease risk.,cucumber,"['disease_risk', 'nutrient_def']",combined
plantvillage/cucumber_septoria_leaf_spot_0192.jpg,The potato field displays wilting leaves. Analysis indicates water stress.,Cucumber plant showing symptoms of septoria leaf spot. Indicates disease risk.,cucumber,"['disease_risk', 'water_stress']",combined
plantvillage/corn_healthy_0193.jpg,"Farmer reported visible insects affecting soybean yield, suggesting pest risk. Additionally, burnt edges suggests heat stress.",Healthy corn plant with no visible signs of stress or disease.,corn,"['heat_stress', 'pest_risk']",combined
plantvillage/cucumber_healthy_0194.jpg,Observed drooping stems in carrot plantation. Diagnosis: water stress.,Healthy cucumber plant with no visible signs of stress or disease.,cucumber,['water_stress'],combined
plantvillage/corn_mosaic_virus_0195.jpg,The rice crop shows visible signs of water stress with premature leaf drop.,Corn plant showing symptoms of mosaic virus. Indicates disease risk.,corn,"['disease_risk', 'water_stress']",combined
plantvillage/tomato_septoria_leaf_spot_0196.jpg,"Farmer reported tissue death affecting potato yield, suggesting heat stress.",Tomato plant showing symptoms of septoria leaf spot. Indicates disease risk.,tomato,"['disease_risk', 'heat_stress']",combined
plantvillage/corn_mosaic_virus_0197.jpg,"Visual inspection of wheat shows blistering, a characteristic of heat stress.",Corn plant showing symptoms of mosaic virus. Indicates disease risk.,corn,"['disease_risk', 'heat_stress']",combined
plantvillage/tomato_bacterial_spot_0198.jpg,"Field inspection revealed cankers in pepper plants, indicating disease risk. Additionally, chewed leaf edges suggests pest risk.",Tomato plant showing symptoms of bacterial spot. Indicates disease risk.,tomato,"['disease_risk', 'pest_risk']",combined
plantvillage/potato_healthy_0199.jpg,"Agricultural assessment: onion exhibits visible insects consistent with pest risk. Additionally, drooping stems suggests water stress.",Healthy potato plant with no visible signs of stress or disease.,potato,"['water_stress', 'pest_risk']",combined
plantvillage/pepper_powdery_mildew_0200.jpg,Agricultural assessment: cotton exhibits blistering consistent with heat stress.,Pepper plant showing symptoms of powdery mildew. Indicates disease risk.,pepper,"['disease_risk', 'heat_stress']",combined
plantvillage/corn_leaf_spot_0201.jpg,"Field inspection revealed necrotic spots in bean plants, indicating nutrient def. Additionally, sun scald suggests heat stress.",Corn plant showing symptoms of leaf spot. Indicates disease risk.,corn,"['disease_risk', 'heat_stress', 'nutrient_def']",combined
plantvillage/potato_early_blight_0202.jpg,"Field inspection revealed interveinal chlorosis in cucumber plants, indicating nutrient def.",Potato plant showing symptoms of early blight. Indicates disease risk.,potato,"['disease_risk', 'nutrient_def']",combined
plantvillage/tomato_yellow_curl_0203.jpg,"Visual inspection of corn shows stunted growth, a characteristic of water stress.",Tomato plant showing symptoms of yellow curl. Indicates nutrient def.,tomato,"['nutrient_def', 'water_stress']",combined
plantvillage/pepper_early_blight_0204.jpg,"Agricultural expert noted tissue death in cabbage crops, signaling heat stress. Additionally, delayed maturity suggests nutrient def.",Pepper plant showing symptoms of early blight. Indicates disease risk.,pepper,"['disease_risk', 'heat_stress', 'nutrient_def']",combined
plantvillage/potato_early_blight_0205.jpg,"carrot plants are experiencing pest risk as evidenced by holes in leaves. Additionally, pale leaf coloration suggests nutrient def.",Potato plant showing symptoms of early blight. Indicates disease risk.,potato,"['disease_risk', 'nutrient_def', 'pest_risk']",combined
plantvillage/cucumber_early_blight_0206.jpg,The tomato crop shows visible signs of pest risk with webbing on plants.,Cucumber plant showing symptoms of early blight. Indicates disease risk.,cucumber,"['disease_risk', 'pest_risk']",combined
plantvillage/potato_late_blight_0207.jpg,"The onion crop shows visible signs of nutrient def with stunted growth. Additionally, dry soil conditions suggests water stress.",Potato plant showing symptoms of late blight. Indicates disease risk.,potato,"['disease_risk', 'nutrient_def', 'water_stress']",combined
plantvillage/tomato_yellow_curl_0208.jpg,"spinach plants are experiencing heat stress as evidenced by burnt edges. Additionally, stunted growth suggests nutrient def.",Tomato plant showing symptoms of yellow curl. Indicates nutrient def.,tomato,"['heat_stress', 'nutrient_def']",combined
plantvillage/potato_bacterial_spot_0209.jpg,Agricultural assessment: potato exhibits leaf curling consistent with water stress.,Potato plant showing symptoms of bacterial spot. Indicates disease risk.,potato,"['disease_risk', 'water_stress']",combined
plantvillage/pepper_healthy_0210.jpg,The rice crop shows visible signs of disease risk with cankers.,Healthy pepper plant with no visible signs of stress or disease.,pepper,['disease_risk'],combined
plantvillage/potato_yellow_curl_0211.jpg,"Agricultural expert noted sun scald in soybean crops, signaling heat stress.",Potato plant showing symptoms of yellow curl. Indicates nutrient def.,potato,"['heat_stress', 'nutrient_def']",combined
plantvillage/potato_mosaic_virus_0212.jpg,"Observed powdery coating in onion plantation. Diagnosis: disease risk. Additionally, necrotic spots suggests nutrient def.",Potato plant showing symptoms of mosaic virus. Indicates disease risk.,potato,"['disease_risk', 'nutrient_def']",combined
plantvillage/corn_mosaic_virus_0213.jpg,"The cotton crop shows visible signs of water stress with wilting leaves. Additionally, stunted growth suggests nutrient def.",Corn plant showing symptoms of mosaic virus. Indicates disease risk.,corn,"['disease_risk', 'nutrient_def', 'water_stress']",combined
plantvillage/cucumber_yellow_curl_0214.jpg,"Agricultural expert noted stunted growth in cucumber crops, signaling nutrient def.",Cucumber plant showing symptoms of yellow curl. Indicates nutrient def.,cucumber,['nutrient_def'],combined
plantvillage/tomato_early_blight_0215.jpg,"bean plants are experiencing pest risk as evidenced by distorted growth. Additionally, powdery coating suggests disease risk.",Tomato plant showing symptoms of early blight. Indicates disease risk.,tomato,"['disease_risk', 'pest_risk']",combined
plantvillage/pepper_leaf_spot_0216.jpg,"Agricultural expert noted flower drop in cabbage crops, signaling heat stress.",Pepper plant showing symptoms of leaf spot. Indicates disease risk.,pepper,"['disease_risk', 'heat_stress']",combined
plantvillage/cucumber_yellow_curl_0217.jpg,The pepper crop shows visible signs of water stress with dry soil conditions.,Cucumber plant showing symptoms of yellow curl. Indicates nutrient def.,cucumber,"['nutrient_def', 'water_stress']",combined
plantvillage/cucumber_yellow_curl_0218.jpg,"Farmer reported rotting tissue affecting potato yield, suggesting disease risk.",Cucumber plant showing symptoms of yellow curl. Indicates nutrient def.,cucumber,"['disease_risk', 'nutrient_def']",combined
plantvillage/corn_mosaic_virus_0219.jpg,"Observed defoliation in bean plantation. Diagnosis: pest risk. Additionally, pale leaf coloration suggests nutrient def.",Corn plant showing symptoms of mosaic virus. Indicates disease risk.,corn,"['disease_risk', 'nutrient_def', 'pest_risk']",combined
plantvillage/pepper_late_blight_0220.jpg,"Observed holes in leaves in wheat plantation. Diagnosis: pest risk. Additionally, cankers suggests disease risk.",Pepper plant showing symptoms of late blight. Indicates disease risk.,pepper,"['disease_risk', 'pest_risk']",combined
plantvillage/corn_healthy_0221.jpg,"Field inspection revealed delayed maturity in spinach plants, indicating nutrient def. Additionally, cankers suggests disease risk.",Healthy corn plant with no visible signs of stress or disease.,corn,"['disease_risk', 'nutrient_def']",combined
plantvillage/potato_yellow_curl_0222.jpg,"The cucumber field displays burnt edges. Analysis indicates heat stress. Additionally, discoloration patterns suggests disease risk.",Potato plant showing symptoms of yellow curl. Indicates nutrient def.,potato,"['disease_risk', 'heat_stress', 'nutrient_def']",combined
plantvillage/potato_yellow_curl_0223.jpg,"Field inspection revealed poor root development in tomato plants, indicating nutrient def. Additionally, defoliation suggests pest risk.",Potato plant showing symptoms of yellow curl. Indicates nutrient def.,potato,"['nutrient_def', 'pest_risk']",combined
plantvillage/pepper_leaf_spot_0224.jpg,The soybean crop shows visible signs of pest risk with defoliation.,Pepper plant showing symptoms of leaf spot. Indicates disease risk.,pepper,"['disease_risk', 'pest_risk']",combined
plantvillage/corn_leaf_spot_0225.jpg,"Agricultural assessment: wheat exhibits lesions on leaves consistent with disease risk. Additionally, pale leaf coloration suggests nutrient def.",Corn plant showing symptoms of leaf spot. Indicates disease risk.,corn,"['disease_risk', 'nutrient_def']",combined
plantvillage/potato_powdery_mildew_0226.jpg,"Agricultural expert noted cankers in tomato crops, signaling disease risk. Additionally, tissue death suggests heat stress.",Potato plant showing symptoms of powdery mildew. Indicates disease risk.,potato,"['disease_risk', 'heat_stress']",combined
plantvillage/corn_septoria_leaf_spot_0227.jpg,"carrot plants are experiencing heat stress as evidenced by blistering. Additionally, honeydew presence suggests pest risk.",Corn plant showing symptoms of septoria leaf spot. Indicates disease risk.,corn,"['disease_risk', 'heat_stress', 'pest_risk']",combined
plantvillage/potato_bacterial_spot_0228.jpg,"potato plants are experiencing pest risk as evidenced by chewed leaf edges. Additionally, flower drop suggests heat stress.",Potato plant showing symptoms of bacterial spot. Indicates disease risk.,potato,"['disease_risk', 'heat_stress', 'pest_risk']",combined
plantvillage/corn_leaf_spot_0229.jpg,"Crop health monitoring detected flower drop in cucumber, pointing to heat stress.",Corn plant showing symptoms of leaf spot. Indicates disease risk.,corn,"['disease_risk', 'heat_stress']",combined
plantvillage/cucumber_mosaic_virus_0230.jpg,"Crop health monitoring detected burnt edges in tomato, pointing to heat stress.",Cucumber plant showing symptoms of mosaic virus. Indicates disease risk.,cucumber,"['disease_risk', 'heat_stress']",combined
plantvillage/cucumber_late_blight_0231.jpg,The cucumber crop shows visible signs of disease risk with lesions on leaves.,Cucumber plant showing symptoms of late blight. Indicates disease risk.,cucumber,['disease_risk'],combined
plantvillage/pepper_bacterial_spot_0232.jpg,"Field inspection revealed webbing on plants in cucumber plants, indicating pest risk. Additionally, blights suggests disease risk.",Pepper plant showing symptoms of bacterial spot. Indicates disease risk.,pepper,"['disease_risk', 'pest_risk']",combined
plantvillage/pepper_leaf_spot_0233.jpg,"Agricultural expert noted flower drop in spinach crops, signaling heat stress. Additionally, wilting leaves suggests water stress.",Pepper plant showing symptoms of leaf spot. Indicates disease risk.,pepper,"['disease_risk', 'heat_stress', 'water_stress']",combined
plantvillage/cucumber_late_blight_0234.jpg,"Farmer reported blistering affecting cabbage yield, suggesting heat stress.",Cucumber plant showing symptoms of late blight. Indicates disease risk.,cucumber,"['disease_risk', 'heat_stress']",combined
plantvillage/potato_mosaic_virus_0235.jpg,pepper plants are experiencing pest risk as evidenced by webbing on plants.,Potato plant showing symptoms of mosaic virus. Indicates disease risk.,potato,"['disease_risk', 'pest_risk']",combined
plantvillage/cucumber_mosaic_virus_0236.jpg,"Farmer reported defoliation affecting rice yield, suggesting pest risk.",Cucumber plant showing symptoms of mosaic virus. Indicates disease risk.,cucumber,"['disease_risk', 'pest_risk']",combined
plantvillage/cucumber_mosaic_virus_0237.jpg,"Field inspection revealed pale leaf coloration in lettuce plants, indicating nutrient def.",Cucumber plant showing symptoms of mosaic virus. Indicates disease risk.,cucumber,"['disease_risk', 'nutrient_def']",combined
plantvillage/cucumber_yellow_curl_0238.jpg,"Agricultural expert noted chewed leaf edges in soybean crops, signaling pest risk.",Cucumber plant showing symptoms of yellow curl. Indicates nutrient def.,cucumber,"['nutrient_def', 'pest_risk']",combined
plantvillage/cucumber_early_blight_0239.jpg,"Visual inspection of cotton shows interveinal chlorosis, a characteristic of nutrient def.",Cucumber plant showing symptoms of early blight. Indicates disease risk.,cucumber,"['disease_risk', 'nutrient_def']",combined
plantvillage/pepper_healthy_0240.jpg,"Field inspection revealed stunted growth in potato plants, indicating nutrient def. Additionally, blights suggests disease risk.",Healthy pepper plant with no visible signs of stress or disease.,pepper,"['disease_risk', 'nutrient_def']",combined
plantvillage/pepper_powdery_mildew_0241.jpg,"Field inspection revealed cankers in wheat plants, indicating disease risk.",Pepper plant showing symptoms of powdery mildew. Indicates disease risk.,pepper,['disease_risk'],combined
plantvillage/cucumber_healthy_0242.jpg,"Crop health monitoring detected leaf spots in cucumber, pointing to disease risk. Additionally, stunted growth suggests nutrient def.",Healthy cucumber plant with no visible signs of stress or disease.,cucumber,"['disease_risk', 'nutrient_def']",combined
plantvillage/pepper_early_blight_0243.jpg,"Agricultural expert noted poor root development in pepper crops, signaling nutrient def.",Pepper plant showing symptoms of early blight. Indicates disease risk.,pepper,"['disease_risk', 'nutrient_def']",combined
plantvillage/tomato_mosaic_virus_0244.jpg,"Field inspection revealed visible insects in soybean plants, indicating pest risk. Additionally, reduced turgor pressure suggests water stress.",Tomato plant showing symptoms of mosaic virus. Indicates disease risk.,tomato,"['disease_risk', 'water_stress', 'pest_risk']",combined
plantvillage/cucumber_early_blight_0245.jpg,"Agricultural expert noted honeydew presence in bean crops, signaling pest risk.",Cucumber plant showing symptoms of early blight. Indicates disease risk.,cucumber,"['disease_risk', 'pest_risk']",combined
plantvillage/pepper_early_blight_0246.jpg,"Field inspection revealed stunted growth in spinach plants, indicating nutrient def. Additionally, distorted growth suggests pest risk.",Pepper plant showing symptoms of early blight. Indicates disease risk.,pepper,"['disease_risk', 'nutrient_def', 'pest_risk']",combined
plantvillage/tomato_powdery_mildew_0247.jpg,"Farmer reported webbing on plants affecting tomato yield, suggesting pest risk.",Tomato plant showing symptoms of powdery mildew. Indicates disease risk.,tomato,"['disease_risk', 'pest_risk']",combined
plantvillage/cucumber_yellow_curl_0248.jpg,"Field inspection revealed rotting tissue in soybean plants, indicating disease risk.",Cucumber plant showing symptoms of yellow curl. Indicates nutrient def.,cucumber,"['disease_risk', 'nutrient_def']",combined
plantvillage/cucumber_late_blight_0249.jpg,"Agricultural expert noted poor root development in rice crops, signaling nutrient def. Additionally, bleached appearance suggests heat stress.",Cucumber plant showing symptoms of late blight. Indicates disease risk.,cucumber,"['disease_risk', 'heat_stress', 'nutrient_def']",combined
plantvillage/pepper_healthy_0250.jpg,spinach plants are experiencing water stress as evidenced by dry soil conditions.,Healthy pepper plant with no visible signs of stress or disease.,pepper,['water_stress'],combined
plantvillage/corn_powdery_mildew_0251.jpg,The potato crop shows visible signs of nutrient def with purple discoloration.,Corn plant showing symptoms of powdery mildew. Indicates disease risk.,corn,"['disease_risk', 'nutrient_def']",combined
plantvillage/potato_mosaic_virus_0252.jpg,The cotton crop shows visible signs of pest risk with honeydew presence.,Potato plant showing symptoms of mosaic virus. Indicates disease risk.,potato,"['disease_risk', 'pest_risk']",combined
plantvillage/corn_powdery_mildew_0253.jpg,"Crop health monitoring detected wilting leaves in spinach, pointing to water stress.",Corn plant showing symptoms of powdery mildew. Indicates disease risk.,corn,"['disease_risk', 'water_stress']",combined
plantvillage/cucumber_early_blight_0254.jpg,"The corn field displays sun scald. Analysis indicates heat stress. Additionally, lesions on leaves suggests disease risk.",Cucumber plant showing symptoms of early blight. Indicates disease risk.,cucumber,"['disease_risk', 'heat_stress']",combined
plantvillage/potato_early_blight_0255.jpg,"Agricultural assessment: onion exhibits purple discoloration consistent with nutrient def. Additionally, leaf curling suggests water stress.",Potato plant showing symptoms of early blight. Indicates disease risk.,potato,"['disease_risk', 'nutrient_def', 'water_stress']",combined
plantvillage/pepper_bacterial_spot_0256.jpg,The bean crop shows visible signs of disease risk with powdery coating.,Pepper plant showing symptoms of bacterial spot. Indicates disease risk.,pepper,['disease_risk'],combined
plantvillage/cucumber_powdery_mildew_0257.jpg,"potato plants are experiencing disease risk as evidenced by rotting tissue. Additionally, leaf curling suggests water stress.",Cucumber plant showing symptoms of powdery mildew. Indicates disease risk.,cucumber,"['disease_risk', 'water_stress']",combined
plantvillage/tomato_mosaic_virus_0258.jpg,"Farmer reported lesions on leaves affecting wheat yield, suggesting disease risk.",Tomato plant showing symptoms of mosaic virus. Indicates disease risk.,tomato,['disease_risk'],combined
plantvillage/tomato_early_blight_0259.jpg,"potato plants are experiencing pest risk as evidenced by webbing on plants. Additionally, premature leaf drop suggests water stress.",Tomato plant showing symptoms of early blight. Indicates disease risk.,tomato,"['disease_risk', 'water_stress', 'pest_risk']",combined
plantvillage/pepper_septoria_leaf_spot_0260.jpg,"Farmer reported webbing on plants affecting carrot yield, suggesting pest risk.",Pepper plant showing symptoms of septoria leaf spot. Indicates disease risk.,pepper,"['disease_risk', 'pest_risk']",combined
plantvillage/potato_yellow_curl_0261.jpg,"Farmer reported defoliation affecting wheat yield, suggesting pest risk.",Potato plant showing symptoms of yellow curl. Indicates nutrient def.,potato,"['nutrient_def', 'pest_risk']",combined
plantvillage/pepper_powdery_mildew_0262.jpg,"Field inspection revealed lesions on leaves in tomato plants, indicating disease risk. Additionally, stunted growth suggests nutrient def.",Pepper plant showing symptoms of powdery mildew. Indicates disease risk.,pepper,"['disease_risk', 'nutrient_def']",combined
plantvillage/pepper_septoria_leaf_spot_0263.jpg,lettuce plants are experiencing pest risk as evidenced by defoliation.,Pepper plant showing symptoms of septoria leaf spot. Indicates disease risk.,pepper,"['disease_risk', 'pest_risk']",combined
plantvillage/potato_powdery_mildew_0264.jpg,The bean crop shows visible signs of nutrient def with stunted growth.,Potato plant showing symptoms of powdery mildew. Indicates disease risk.,potato,"['disease_risk', 'nutrient_def']",combined
plantvillage/potato_mosaic_virus_0265.jpg,"Crop health monitoring detected blistering in cabbage, pointing to heat stress.",Potato plant showing symptoms of mosaic virus. Indicates disease risk.,potato,"['disease_risk', 'heat_stress']",combined
plantvillage/potato_healthy_0266.jpg,"Agricultural assessment: wheat exhibits fruit sunburn consistent with heat stress. Additionally, cankers suggests disease risk.",Healthy potato plant with no visible signs of stress or disease.,potato,"['disease_risk', 'heat_stress']",combined
plantvillage/tomato_mosaic_virus_0267.jpg,"The wheat field displays drooping stems. Analysis indicates water stress. Additionally, flower drop suggests heat stress.",Tomato plant showing symptoms of mosaic virus. Indicates disease risk.,tomato,"['disease_risk', 'heat_stress', 'water_stress']",combined
plantvillage/cucumber_yellow_curl_0268.jpg,"Crop health monitoring detected rotting tissue in lettuce, pointing to disease risk. Additionally, holes in leaves suggests pest risk.",Cucumber plant showing symptoms of yellow curl. Indicates nutrient def.,cucumber,"['disease_risk', 'nutrient_def', 'pest_risk']",combined
plantvillage/cucumber_powdery_mildew_0269.jpg,The spinach crop shows visible signs of water stress with leaf curling.,Cucumber plant showing symptoms of powdery mildew. Indicates disease risk.,cucumber,"['disease_risk', 'water_stress']",combined
plantvillage/cucumber_late_blight_0270.jpg,"Agricultural expert noted bleached appearance in spinach crops, signaling heat stress. Additionally, moldy growth suggests disease risk.",Cucumber plant showing symptoms of late blight. Indicates disease risk.,cucumber,"['disease_risk', 'heat_stress']",combined
plantvillage/potato_early_blight_0271.jpg,"Crop health monitoring detected moldy growth in carrot, pointing to disease risk.",Potato plant showing symptoms of early blight. Indicates disease risk.,potato,['disease_risk'],combined
plantvillage/corn_early_blight_0272.jpg,"Crop health monitoring detected blights in bean, pointing to disease risk. Additionally, chewed leaf edges suggests pest risk.",Corn plant showing symptoms of early blight. Indicates disease risk.,corn,"['disease_risk', 'pest_risk']",combined
plantvillage/pepper_powdery_mildew_0273.jpg,The corn field displays webbing on plants. Analysis indicates pest risk.,Pepper plant showing symptoms of powdery mildew. Indicates disease risk.,pepper,"['disease_risk', 'pest_risk']",combined
plantvillage/corn_mosaic_virus_0274.jpg,"tomato plants are experiencing water stress as evidenced by stunted growth. Additionally, insect damage suggests pest risk.",Corn plant showing symptoms of mosaic virus. Indicates disease risk.,corn,"['disease_risk', 'water_stress', 'pest_risk']",combined
plantvillage/tomato_leaf_spot_0275.jpg,"Field inspection revealed burnt edges in lettuce plants, indicating heat stress.",Tomato plant showing symptoms of leaf spot. Indicates disease risk.,tomato,"['disease_risk', 'heat_stress']",combined
plantvillage/pepper_powdery_mildew_0276.jpg,"Visual inspection of soybean shows interveinal chlorosis, a characteristic of nutrient def. Additionally, discoloration patterns suggests disease risk.",Pepper plant showing symptoms of powdery mildew. Indicates disease risk.,pepper,"['disease_risk', 'nutrient_def']",combined
plantvillage/corn_mosaic_virus_0277.jpg,"Visual inspection of pepper shows visible insects, a characteristic of pest risk.",Corn plant showing symptoms of mosaic virus. Indicates disease risk.,corn,"['disease_risk', 'pest_risk']",combined
plantvillage/tomato_mosaic_virus_0278.jpg,"The carrot field displays reduced turgor pressure. Analysis indicates water stress. Additionally, interveinal chlorosis suggests nutrient def.",Tomato plant showing symptoms of mosaic virus. Indicates disease risk.,tomato,"['disease_risk', 'nutrient_def', 'water_stress']",combined
plantvillage/potato_late_blight_0279.jpg,"Observed visible insects in pepper plantation. Diagnosis: pest risk. Additionally, dry soil conditions suggests water stress.",Potato plant showing symptoms of late blight. Indicates disease risk.,potato,"['disease_risk', 'water_stress', 'pest_risk']",combined
plantvillage/pepper_late_blight_0280.jpg,"Agricultural expert noted reduced turgor pressure in lettuce crops, signaling water stress. Additionally, flower drop suggests heat stress.",Pepper plant showing symptoms of late blight. Indicates disease risk.,pepper,"['disease_risk', 'heat_stress', 'water_stress']",combined
plantvillage/corn_late_blight_0281.jpg,"Visual inspection of pepper shows blistering, a characteristic of heat stress. Additionally, stunted growth suggests water stress.",Corn plant showing symptoms of late blight. Indicates disease risk.,corn,"['disease_risk', 'heat_stress', 'water_stress']",combined
plantvillage/cucumber_yellow_curl_0282.jpg,"cotton plants are experiencing disease risk as evidenced by leaf spots. Additionally, leaf curling suggests water stress.",Cucumber plant showing symptoms of yellow curl. Indicates nutrient def.,cucumber,"['disease_risk', 'nutrient_def', 'water_stress']",combined
plantvillage/corn_bacterial_spot_0283.jpg,"Farmer reported chewed leaf edges affecting onion yield, suggesting pest risk.",Corn plant showing symptoms of bacterial spot. Indicates disease risk.,corn,"['disease_risk', 'pest_risk']",combined
